{
  "evidence_id": "E001b",
  "value": "−22.618",
  "label": "학력 중졸이하 효과(모형1, SE 0.770)",
  "provenance": [
    "P001b"
  ],
  "status": "active",
  "supersedes": null,
  "checked_by": "stats-validator",
  "by": "manuscript-steward",
  "note": "보관=steward, 검증=sv. numeric-canon-B.md 정본.",
  "ts_ns": 1782608443048000000
}
