{
  "evidence_id": "E005",
  "value": "772",
  "label": "223건에서 생성된 지역 가설 총수",
  "provenance": [
    "P005"
  ],
  "status": "active",
  "supersedes": null,
  "checked_by": "stats-validator",
  "by": "manuscript-steward",
  "note": "보관=steward, 검증=sv. numeric-canon-B.md 정본.",
  "ts_ns": 1782608443048000000
}
