{
  "evidence_id": "E009",
  "value": "0.279",
  "label": "종합 지수 최저(중랑구, 서울내 min-max)",
  "provenance": [
    "P009"
  ],
  "status": "active",
  "supersedes": null,
  "checked_by": "stats-validator",
  "by": "manuscript-steward",
  "note": "보관=steward, 검증=sv. numeric-canon-B.md 정본.",
  "ts_ns": 1782608443048000000
}
