{
  "evidence_id": "E004",
  "value": "223건",
  "label": "표적 3구 단계 E 판정 게시글",
  "provenance": [
    "P004"
  ],
  "status": "active",
  "supersedes": null,
  "checked_by": "stats-validator",
  "by": "manuscript-steward",
  "note": "보관=steward, 검증=sv. numeric-canon-B.md 정본.",
  "ts_ns": 1782608443048000000
}
