{
  "evidence_id": "E007",
  "value": "84.7%",
  "label": "UMC 관련성 정밀도(LLM Y→인간 확인)",
  "provenance": [
    "P007"
  ],
  "status": "active",
  "supersedes": null,
  "checked_by": "stats-validator",
  "by": "manuscript-steward",
  "note": "보관=steward, 검증=sv. numeric-canon-B.md 정본.",
  "ts_ns": 1782608443048000000
}
