{
  "evidence_id": "E003",
  "value": "131,792",
  "label": "행정동 매칭 성공 LLM 분류 표본",
  "provenance": [
    "P003"
  ],
  "status": "active",
  "supersedes": null,
  "checked_by": "stats-validator",
  "by": "manuscript-steward",
  "note": "보관=steward, 검증=sv. numeric-canon-B.md 정본.",
  "ts_ns": 1782608443048000000
}
