{
  "evidence_id": "E006",
  "value": "−9.303",
  "label": "65세 이상 효과(모형4, SE 0.467)",
  "provenance": [
    "P006"
  ],
  "status": "active",
  "supersedes": null,
  "checked_by": "stats-validator",
  "by": "manuscript-steward",
  "note": "보관=steward, 검증=sv. numeric-canon-B.md 정본.",
  "ts_ns": 1782608443048000000
}
