{
  "evidence_id": "E002",
  "value": "10,000명",
  "label": "서울서베이 HLM 표본(2023–2024 통합)",
  "provenance": [
    "P002"
  ],
  "status": "active",
  "supersedes": null,
  "checked_by": "stats-validator",
  "by": "manuscript-steward",
  "note": "보관=steward, 검증=sv. numeric-canon-B.md 정본.",
  "ts_ns": 1782608443048000000
}
